{
  "decision": {
    "priority": "urgent",
    "operator_review": "Not Required",
    "data_quality": "Good"
  },
  "summary": "범지기마을10단지아파트 26번 열수급 지점에서 긴급 수준의 압력 조절 계통 이상이 의심됩니다. 위험도와 의심 유형이 함께 높게 나타났고, 판단 근거도 일관되어 현장 확인이 필요합니다. 세종의 해당 아파트 지역은 난방과 급탕이 함께 연결된 구조라서 압력 변화가 있으면 영향 범위가 넓을 수 있습니다.",
  "action_plan": [
    "1차측 공급·환수 압력과 차압을 먼저 확인해 평소 범위를 벗어나는지 보십시오.",
    "압력 조절 밸브 주변의 개폐 상태, 작동 흔들림, 소음, 진동, 누설 흔적을 점검하십시오.",
    "제어 신호와 현장 실제 위치가 맞는지 확인하고, 지시값과 실제 압력 변화가 다르면 즉시 기록하십시오.",
    "난방 회로와 급탕 회로를 나눠서 각각의 유량·온도·압력 반응을 비교하십시오.",
    "범지기마을10단지아파트 기계실에서 해당 열수급 지점의 운전값과 주요 센서 계통을 우선 대조합니다."
  ],
  "caution": [
    "압력 계통은 갑작스러운 변동이 있을 수 있으니 밸브 조작은 한 번에 크게 하지 마십시오.",
    "누설이나 비정상 소음이 보이면 가까이 접근해 오래 확인하지 말고 안전거리에서 상태를 보십시오.",
    "이번 판단은 긴급 수준이지만 현장 계측으로 최종 확인해야 하므로 단정하지 마십시오.",
    "추가 점검 항목은 원인 확정이 아니라 확인 범위를 좁히기 위한 보조 기준입니다."
  ],
  "evidence": {
    "priority_score": 95.4377112934,
    "current_best": "urgent",
    "m1_specialist": "pressure_regulator",
    "main_signals": [
      "대상 단지: 범지기마을10단지아파트 (26번 열수급 지점)",
      "기상 요인: 강수 발생",
      "위험도: 긴급",
      "의심 유형: 압력 조절 계통 이상 의심",
      "판단 근거: 위험도와 의심 유형이 함께 높게 나타남"
    ],
    "used_tools": [
      "get_ops_evidence",
      "get_external_context",
      "get_site_context",
      "get_weather_context",
      "rag_http_server"
    ]
  }
}
