{
  "decision": {
    "priority": "high",
    "operator_review": "Required",
    "data_quality": "Medium"
  },
  "summary": "세종 가락마을10단지이지더원아파트 11번 열수급 지점에서 위험도가 높게 나타났고, 누수 또는 보충수 손실 의심이 우선 확인됩니다. 판단 근거가 일관되게 높아 즉시 현장 점검이 필요하며, 난방과 급탕이 함께 있는 설비 특성상 영향 범위도 함께 확인해야 합니다. 조회 구간의 기상 요인은 뚜렷하지 않아, 이번 건은 설비 측 이상 여부를 중심으로 봐야 합니다.",
  "action_plan": [
    "현장 계기에서 차압, 유량, 공급·환수 온도 변화를 우선 확인하고 평소 운전값과 비교하십시오.",
    "보충수 사용량과 급수 압력 변화를 확인해, 짧은 시간에 보충수가 늘었는지 점검하십시오.",
    "배관, 밸브, 열교환기, 이음부, 드레인 주변에 물기, 적하, 백화, 부식 흔적이 있는지 순서대로 확인하십시오.",
    "난방 회로와 급탕 회로를 나눠서 보고, 어느 계통에서 압력 저하나 유량 이상이 먼저 나타나는지 확인하십시오.",
    "가락마을10단지이지더원아파트 기계실에서 해당 열수급 지점의 운전값과 주요 센서 계통을 우선 대조합니다."
  ],
  "caution": [
    "현재는 이상 가능성이 높지만, 누수로 단정할 수준의 현장 증거는 아직 확인되지 않았습니다.",
    "압력 저하가 보이더라도 급격한 밸브 조작은 피하고, 단계적으로 변화를 보면서 조치하십시오.",
    "열원 공급은 유지하되, 이상 확대가 보이면 관련 회로를 분리해 추가 손실을 막으십시오.",
    "추가 점검 항목은 원인 확정이 아니라 확인 범위를 좁히기 위한 보조 기준입니다."
  ],
  "evidence": {
    "priority_score": 93.6835893672,
    "current_best": "urgent",
    "m1_specialist": "leakage_water_loss",
    "main_signals": [
      "대상 단지: 가락마을10단지이지더원아파트 (11번 열수급 지점)",
      "기상 요인: 조회 구간에서 이상 신호 해석을 보완할 만한 뚜렷한 기상 요인은 확인되지 않았습니다.",
      "위험도: 높음",
      "의심 유형: 누수 또는 보충수 손실 의심",
      "판단 근거: 위험도와 의심 유형이 함께 높게 나타남"
    ],
    "used_tools": [
      "get_ops_evidence",
      "get_external_context",
      "get_site_context",
      "get_weather_context",
      "rag_http_server"
    ]
  }
}
