{
  "decision": {
    "priority": "medium",
    "operator_review": "Required",
    "data_quality": "Medium"
  },
  "summary": "가락마을14단지우남퍼스트빌아파트 14번 열수급 지점은 위험도는 중간이지만, 이상 신호가 기준에 가까워 현장 확인이 필요한 상태입니다. 의심 유형은 아직 확정되지 않았고, 판단 근거가 한쪽으로만 강하지 않아 난방회로와 급탕 계통을 함께 점검해야 합니다. 세종 지역의 외기 조건은 난방 부하를 조금 높일 수는 있으나, 현재 상태를 설명할 만큼 강한 원인으로 보기는 어렵습니다.",
  "action_plan": [
    "기계실에서 난방 순환 상태를 먼저 확인하고, 순환이 약해지거나 멈춘 구간이 없는지 점검합니다.",
    "난방회로와 급탕회로의 온도·압력 변화가 서로 맞는지 확인하고, 급격한 출렁임이나 불균형이 있는지 봅니다.",
    "열교환기 전후 온도차와 유량 상태를 확인해 막힘, 오염, 열전달 저하 징후가 있는지 점검합니다.",
    "밸브 개도 상태와 조작 응답을 확인하고, 실제 명령과 현장 반응이 일치하는지 확인합니다.",
    "가락마을14단지우남퍼스트빌아파트 기계실에서 해당 열수급 지점의 운전값과 주요 센서 계통을 우선 대조합니다."
  ],
  "caution": [
    "운전 중인 설비는 고온·고압일 수 있으니 임의 분해나 급격한 조작은 피하십시오.",
    "지금 단계에서는 고장 유형이 확정되지 않았으므로 한 계통만 보고 단정하지 말고, 난방과 급탕을 함께 확인해야 합니다.",
    "수치가 경계값 근처일 수 있어 일시 변동과 지속 이상을 구분해 기록하십시오.",
    "추가 점검 항목은 원인 확정이 아니라 확인 범위를 좁히기 위한 보조 기준입니다."
  ],
  "evidence": {
    "priority_score": 82.4791178416,
    "current_best": "urgent",
    "m1_specialist": "unknown_review",
    "main_signals": [
      "대상 단지: 가락마을14단지우남퍼스트빌아파트 (14번 열수급 지점)",
      "기상 요인: 난방도시 기준 난방 부하 증가 가능",
      "위험도: 중간",
      "의심 유형: 고장 유형 미확정",
      "판단 근거: 위험도는 높지만 의심 유형 근거는 약해 추가 확인 필요"
    ],
    "used_tools": [
      "get_ops_evidence",
      "get_external_context",
      "get_site_context",
      "get_weather_context",
      "rag_http_server"
    ]
  }
}
