{
  "decision": {
    "priority": "high",
    "operator_review": "Required",
    "data_quality": "Medium"
  },
  "summary": "해당 구간은 위험도가 높아 즉시 점검이 필요한 상태입니다. 누수 또는 보충수 손실이 의심되며, 위험도와 의심 유형이 함께 높게 나타나 현장 확인이 필요합니다. 이상 확정 전 단계이므로 압력 변화와 보충수 사용량을 중심으로 빠르게 확인해 주십시오.",
  "action_plan": [
    "1차로 열원 및 순환 계통의 압력 변화를 확인하고, 최근 짧은 시간 내 하강이 있었는지 기록하십시오.",
    "보충수 사용량이 평소보다 늘었는지 확인하고, 급격한 증가가 있으면 누수 가능성을 우선 점검하십시오.",
    "배관, 밸브, 이음부, 열교환기 주변에서 물맺힘이나 젖은 흔적, 바닥 유출 흔적이 있는지 육안 점검하십시오.",
    "해당 구간의 운전 상태를 줄여가며 소음, 진동, 유량 변화가 함께 나타나는지 확인하십시오.",
    "압력 저하와 보충수 증가가 동시에 확인되면 즉시 상위 담당자에게 보고하고 추가 확산 여부를 점검하십시오."
  ],
  "caution": [
    "현재는 이상 의심 단계이므로 현장 확인 전까지는 누수로 단정하지 마십시오.",
    "압력 회복만으로 종료하지 말고, 보충수 증가와 외관 흔적을 함께 확인해야 합니다.",
    "점검 중에는 고온 배관과 미끄러운 바닥에 주의하고, 보호구를 착용하십시오."
  ],
  "evidence": {
    "priority_score": 93.6835893672,
    "current_best": "urgent",
    "m1_specialist": "leakage_water_loss",
    "main_signals": [
      "검토 사유: 위험도는 높지만 이상 확정 전 상태",
      "위험도: 높음",
      "의심 유형: 누수 또는 보충수 손실 의심",
      "판단 근거: 위험도와 의심 유형이 함께 높게 나타남"
    ],
    "used_tools": [
      "get_ops_evidence",
      "get_external_context"
    ]
  }
}
