{
  "decision": {
    "priority": "low",
    "operator_review": "Required",
    "data_quality": "Unknown"
  },
  "summary": "가재마을12단지중흥S클래스센텀파크2차아파트 22번 열수급 지점은 위험도는 낮게 분류되지만, 이상 신호가 기준선에 가까워 추가 확인이 필요합니다. 의심 유형은 아직 특정되지 않았고, 판정 근거가 서로 완전히 일치하지 않아 현장 점검으로 실제 상태를 확인해야 합니다. 이번 시간대에는 난방 부하에 영향을 줄 수 있는 외기 조건이 약간 있었지만, 이를 고장 원인으로 단정할 수준은 아닙니다.",
  "action_plan": [
    "열교환기 전후 온도와 압력 차를 먼저 확인해 난방과 급탕 쪽 흐름이 정상인지 살펴보십시오.",
    "순환 상태가 약해 보이면 펌프 운전음, 진동, 전류, 자동정지 여부를 점검하십시오.",
    "주요 밸브가 열림 상태인지, 걸림이나 작동 지연이 없는지 수동 조작으로 확인하십시오.",
    "필터 막힘, 공기 혼입, 누수 흔적, 계기 오차 여부를 함께 확인하십시오.",
    "가재마을12단지중흥S클래스센텀파크2차아파트 기계실에서 해당 열수급 지점의 운전값과 주요 센서 계통을 우선 대조합니다."
  ],
  "caution": [
    "현재는 위험도 판단은 낮지만 근거가 충분히 강하지 않아 단정은 금물입니다.",
    "현장 점검 전에는 설정값을 임의로 바꾸지 말고, 변경이 필요하면 기준값을 먼저 기록하십시오.",
    "압력 저하나 급격한 온도 변동이 보이면 즉시 무리한 재가동보다 원인 확인을 우선하십시오.",
    "추가 점검 항목은 원인 확정이 아니라 확인 범위를 좁히기 위한 보조 기준입니다."
  ],
  "evidence": {
    "priority_score": 49.4420918244,
    "current_best": "high",
    "m1_specialist": "unknown_review",
    "main_signals": [
      "대상 단지: 가재마을12단지중흥S클래스센텀파크2차아파트 (22번 열수급 지점)",
      "기상 요인: 난방도시 기준 난방 부하 증가 가능",
      "위험도: 낮음",
      "의심 유형: 고장 유형 미확정",
      "판단 근거: 위험도는 높지만 의심 유형 근거는 약해 추가 확인 필요"
    ],
    "used_tools": [
      "get_ops_evidence",
      "get_external_context",
      "get_site_context",
      "get_weather_context",
      "rag_http_server"
    ]
  }
}
