{
  "decision": {
    "priority": "urgent",
    "operator_review": "Required",
    "data_quality": "Medium"
  },
  "summary": "도램마을19단지아파트 10번 열수급 지점은 위험도가 긴급 수준이며, 제어기 계통 이상 의심이 강하게 나타납니다. 위험도와 의심 유형이 함께 높고 이상 기준에 근접한 신호가 보여 즉시 현장 확인이 필요합니다. 다만 아직 이상이 확정된 상태는 아니어서 운전값과 현장 상태를 함께 점검해야 합니다.",
  "action_plan": [
    "제어반에서 운전 모드, 경보 이력, 수동 전환 여부를 먼저 확인하고 최근 설정값 변경이 있었는지 살펴보세요.",
    "현장에서 제어기 전원, 통신 상태, 접점 연결, 배선 풀림이나 흔들림이 있는지 순서대로 점검하세요.",
    "난방 회로의 밸브 동작과 개폐 반응을 확인하고, 지령값 대비 실제 반응이 늦거나 멈춤이 없는지 보세요.",
    "급탕과 난방의 공급·환수 온도 차를 확인해 비정상적으로 벌어지거나 좁아진 구간이 있는지 비교하세요.",
    "도램마을19단지아파트 기계실에서 해당 열수급 지점의 운전값과 주요 센서 계통을 우선 대조합니다."
  ],
  "caution": [
    "현재는 위험도가 높지만 이상이 확정된 것은 아니므로, 즉시 단정하지 말고 계통별로 분리해서 확인하세요.",
    "점검 중 수동 조작이 필요하면 급격한 밸브 조작은 피하고, 다른 설비에 영향이 없는지 확인하면서 천천히 진행하세요.",
    "전기부와 제어부를 확인할 때는 감전과 오조작 위험에 주의하고, 이상 열이나 탄 흔적이 있으면 즉시 작업을 중지하세요.",
    "추가 점검 항목은 원인 확정이 아니라 확인 범위를 좁히기 위한 보조 기준입니다."
  ],
  "evidence": {
    "priority_score": 99.8457181088,
    "current_best": "urgent",
    "m1_specialist": "control_controller",
    "main_signals": [
      "대상 단지: 도램마을19단지아파트 (10번 열수급 지점)",
      "기상 요인: 조회 구간에서 이상 신호 해석을 보완할 만한 뚜렷한 기상 요인은 확인되지 않았습니다.",
      "위험도: 긴급",
      "의심 유형: 제어기/컨트롤러 이상 의심",
      "판단 근거: 위험도와 의심 유형이 함께 높게 나타남"
    ],
    "used_tools": [
      "get_ops_evidence",
      "get_external_context",
      "get_site_context",
      "get_weather_context",
      "rag_http_server"
    ]
  }
}
