{
  "decision": {
    "priority": "urgent",
    "operator_review": "Not Required",
    "data_quality": "Good"
  },
  "summary": "위험도는 긴급이며, 압력 조절 계통 이상 의심이 강하게 나타납니다. 판단 근거가 일관되어 있어 현장 재확인이 필요하고, 운전 중 압력 변동이나 제어 반응 이상이 없는지 즉시 점검해야 합니다.",
  "action_plan": [
    "1차측과 2차측 압력계를 함께 확인해 평상시 대비 급변, 편차, 맥동이 있는지 먼저 보십시오.",
    "압력 조절기 주변 배관과 연결부에서 진동, 소음, 헌팅, 미세 누설 흔적이 있는지 확인하십시오.",
    "관련 밸브와 바이패스 계통이 정상 위치인지 확인하고, 수동 조작 시 응답이 지연되거나 걸림이 없는지 점검하십시오.",
    "제어 신호와 실제 압력 변화가 같이 움직이는지 확인해 센서 값 이상과 기계적 이상을 구분하십시오.",
    "필요 시 부하를 급격히 바꾸지 말고, 이상 징후가 커지면 즉시 상위 담당자에게 보고한 뒤 안전 절차에 따라 조치하십시오."
  ],
  "caution": [
    "압력 계통은 갑작스런 변화가 있을 수 있으니 현장 접근 시 보호구를 착용하십시오.",
    "밸브나 조절기 조작은 한 번에 크게 하지 말고 단계적으로 시행하십시오.",
    "소음이나 진동이 커지거나 압력 불안정이 확대되면 즉시 점검을 중단하고 안전 조치를 우선하십시오."
  ],
  "evidence": {
    "priority_score": 95.4377112934,
    "current_best": "urgent",
    "m1_specialist": "pressure_regulator",
    "main_signals": [
      "위험도: 긴급",
      "의심 유형: 압력 조절 계통 이상 의심",
      "판단 근거: 위험도와 의심 유형이 함께 높게 나타남"
    ],
    "used_tools": [
      "get_ops_evidence",
      "get_external_context"
    ]
  }
}
