{
  "decision": {
    "priority": "low",
    "operator_review": "Required",
    "data_quality": "Unknown"
  },
  "summary": "세종 아파트열원 구간으로 보이는 SH+DHW 운전 자료에서 위험도는 낮음으로 정리되지만, 이상 징후가 기준선에 가까워 현장 확인이 필요합니다. 현재는 의심 유형이 분명하지 않아, 순환 상태와 압력·온도 변화가 실제로 안정적인지 점검해야 합니다. 판단 근거는 한쪽 판단만 높게 나온 반면 다른 판단은 낮게 나와 일관성이 부족하다는 점입니다.",
  "action_plan": [
    "해당 구간의 순환 상태를 먼저 확인하고, 유량 저하나 간헐적인 끊김이 없는지 보십시오.",
    "1차·2차 측 공급 및 환수 온도 차와 압력 변화를 함께 확인해 평소 범위를 벗어나는지 보십시오.",
    "열원기기와 관련 밸브 주변에서 소음, 진동, 누설 흔적, 과열 징후가 있는지 점검하십시오.",
    "계측값이 순간적으로 흔들리는지 확인하고, 현장 표시값과 원격 표시값이 크게 다르지 않은지 대조하십시오.",
    "최근 부하 변동이나 외기 영향으로 운전이 흔들린 것은 아닌지 함께 확인해 기록하십시오."
  ],
  "caution": [
    "현재는 의심 유형이 확정되지 않았으므로 한 항목만 보고 결론 내리지 마십시오.",
    "점검 중 압력 변동이 크거나 이상 소음이 있으면 무리하게 운전을 지속하지 말고 즉시 추가 확인하십시오.",
    "외기 영향이나 부하 변화는 참고만 하되, 고장 원인으로 단정하지 마십시오."
  ],
  "evidence": {
    "priority_score": 49.4420918244,
    "current_best": "high",
    "m1_specialist": "unknown_review",
    "main_signals": [
      "검토 사유: 이상 기준에 근접한 신호",
      "위험도: 낮음",
      "의심 유형: 고장 유형 미확정",
      "판단 근거: 위험도는 높지만 의심 유형 근거는 약해 추가 확인 필요"
    ],
    "used_tools": [
      "get_ops_evidence",
      "get_external_context"
    ]
  }
}
