{
  "decision": {
    "priority": "high",
    "operator_review": "Required",
    "data_quality": "Medium"
  },
  "summary": "위험도는 높고, 밸브 구동부 이상 의심이 강하게 나타나 즉시 점검이 필요한 상태입니다. 위험도와 의심 유형이 함께 높게 나타나 판단 근거가 일관되므로, 현장 확인 없이 운전 상태를 단정하기 어렵습니다. 현재는 이상 의심 단계이므로 신속한 확인이 필요합니다.",
  "action_plan": [
    "밸브 구동부의 작동 상태를 현장에서 직접 확인하고, 개폐 응답이 지연되거나 걸림이 있는지 점검하세요.",
    "제어 신호를 넣었을 때 밸브가 실제로 따라 움직이는지 확인하고, 명령값과 실제 위치가 어긋나는지 살펴보세요.",
    "구동부 연결부, 링크, 체결 상태, 이물 끼임, 마모 흔적이 있는지 육안 점검하세요.",
    "관련 회로의 전원 공급과 신호 전달 상태를 확인하고, 간헐적인 끊김이나 이상 진동이 있는지 확인하세요.",
    "동일 계통의 다른 밸브와 비교해 동작 차이가 있는지 확인한 뒤, 필요 시 수동 조작 가능 여부를 점검하세요."
  ],
  "caution": [
    "출구 온도나 유량 변동이 있을 수 있으니, 점검 전후로 계통 변화를 천천히 확인하세요.",
    "무리한 강제 조작은 추가 손상을 부를 수 있으므로, 걸림이 느껴지면 즉시 중지하세요.",
    "운전 중 안전 확보가 우선이며, 이상이 커 보이면 관련 계통을 단계적으로 분리해 점검하세요."
  ],
  "evidence": {
    "priority_score": 94.7344222405,
    "current_best": "urgent",
    "m1_specialist": "valve_actuator",
    "main_signals": [
      "검토 사유: 위험도는 높지만 이상 확정 전 상태",
      "위험도: 높음",
      "의심 유형: 밸브 구동부 이상 의심",
      "판단 근거: 위험도와 의심 유형이 함께 높게 나타남"
    ],
    "used_tools": [
      "get_ops_evidence",
      "get_external_context"
    ]
  }
}
