{
  "decision": {
    "priority": "urgent",
    "operator_review": "Required",
    "data_quality": "Medium"
  },
  "summary": "위험도는 긴급 수준이며, 고장 유형은 아직 확정되지 않았지만 이상 의심 신호가 강하게 나타났습니다. 판단 근거가 일관되어 즉시 현장 확인이 필요하며, 특히 순환계와 압력 변동, 열공급 상태를 우선 점검해야 합니다. 이번 건은 이상 기준에 가까운 상태라 운전 중 변화가 커질 수 있으므로 신속한 리뷰가 필요합니다.",
  "action_plan": [
    "열원과 배관 계통의 현재 압력, 온도, 유량을 먼저 확인해 평소 운전 범위에서 벗어난 값이 있는지 보십시오.",
    "순환펌프 및 관련 전동기에서 진동, 소음, 과열, 전류 변동이 있는지 즉시 점검하십시오.",
    "압력 저하, 급변, 맥동이 있는지 확인하고, 보충수 투입이 늘었는지도 함께 보십시오.",
    "주요 밸브와 차단기 주변에서 누수, 결로, 막힘, 오조작 흔적이 있는지 현장에서 확인하십시오.",
    "경보 이력과 최근 운전 변경 사항을 대조해 이상이 처음 시작된 시점을 좁히고, 필요 시 부하를 낮춰 추이를 관찰하십시오."
  ],
  "caution": [
    "설비를 정지하거나 전환할 때는 급격한 압력 변화를 피하고, 천천히 조작하십시오.",
    "현재는 고장 유형이 확정되지 않았으므로 한 가지 원인으로 단정하지 말고 복합 이상 가능성까지 같이 보십시오.",
    "고온 배관과 회전체 주변 점검 시 보호구를 착용하고 접근 범위를 지키십시오.",
    "이상 신호가 커지면 즉시 상위 담당자에게 알리고 무리한 재가동은 피하십시오."
  ],
  "evidence": {
    "priority_score": 95.0149541155,
    "current_best": "urgent",
    "m1_specialist": "unknown_review",
    "main_signals": [
      "검토 사유: 이상 기준에 근접한 신호",
      "위험도: 긴급",
      "의심 유형: 고장 유형 미확정",
      "판단 근거: 위험도와 의심 유형이 함께 높게 나타남"
    ],
    "used_tools": [
      "get_ops_evidence",
      "get_external_context"
    ]
  }
}
