{
  "decision": {
    "priority": "urgent",
    "operator_review": "Required",
    "data_quality": "Medium"
  },
  "summary": "위험도는 긴급 수준이며, 제어기/컨트롤러 이상 의심이 가장 강합니다. 위험도와 의심 유형이 함께 높게 나타나고 이상 기준에 근접한 신호가 있어 현장 확인이 필요합니다. 현재 상태는 이상 의심 단계이므로 즉시 점검해 실제 고장 여부를 가려야 합니다.",
  "action_plan": [
    "제어반 표시값과 경보 이력을 먼저 확인하고, 최근 반복 알람이 있는지 살펴보십시오.",
    "제어기 전원, 통신 상태, 접점 상태를 순서대로 점검하고 느슨한 배선이나 단선 흔적이 없는지 확인하십시오.",
    "순환 흐름과 공급·회수 온도 변화가 평소와 다른지 확인해 제어 신호가 실제 설비 반응과 맞는지 보십시오.",
    "밸브와 구동부가 명령대로 움직이는지 현장에서 동작 시험을 하고, 걸림이나 지연이 있으면 즉시 기록하십시오.",
    "이상 징후가 이어지면 수동 운전 전환 가능 여부를 확인하고, 관련 담당자에게 긴급 보고하십시오."
  ],
  "caution": [
    "제어기 계통 점검 중에는 예기치 않은 기동이 있을 수 있으니 접근 전 안전조치를 먼저 하십시오.",
    "이 상태는 고장 확정이 아니라 이상 의심 단계이므로, 현장 확인 전 단정하지 마십시오.",
    "운전 중 강제로 조작하면 2차 이상이 커질 수 있으니 변경은 절차에 따라 단계적으로 진행하십시오."
  ],
  "evidence": {
    "priority_score": 99.8457181088,
    "current_best": "urgent",
    "m1_specialist": "control_controller",
    "main_signals": [
      "검토 사유: 이상 기준에 근접한 신호",
      "위험도: 긴급",
      "의심 유형: 제어기/컨트롤러 이상 의심",
      "판단 근거: 위험도와 의심 유형이 함께 높게 나타남"
    ],
    "used_tools": [
      "get_ops_evidence",
      "get_external_context"
    ]
  }
}
