{
  "decision": {
    "priority": "medium",
    "operator_review": "Required",
    "data_quality": "Medium"
  },
  "summary": "위험도는 중간이지만 이상 신호가 기준에 근접해 있어 현장 확인이 필요합니다. 구체적인 고장 유형은 아직 확정되지 않았고, 판단 근거가 서로 완전히 일치하지 않아 순환·압력 계통을 우선 점검해야 합니다. 세종 아파트 단지 해당 설비는 현재 정상 범위로 단정하기 어려우므로 운전 상태를 바로 확인해 주십시오.",
  "action_plan": [
    "순환펌프 가동 상태, 기동 신호, 전류값, 진동·이음 여부를 먼저 확인하십시오.",
    "공급·환수 압력과 차압이 평소 운전값에서 벗어났는지 확인하고, 급변 구간이 있으면 기록하십시오.",
    "밸브 개도 상태와 제어 응답이 실제 현장 상태와 맞는지 확인하고, 걸림이나 지연이 있는지 점검하십시오.",
    "급탕과 난방 부하가 동시에 걸린 시간대의 유량 변화를 확인해 비정상적인 흔들림이 있는지 살펴보십시오.",
    "이상 징후가 반복되면 관련 계통을 분리해 단계적으로 재확인하고, 즉시 운전일지를 남기십시오."
  ],
  "caution": [
    "압력과 유량이 불안정할 수 있으니 점검 중에는 급격한 조작을 피하십시오.",
    "현재는 고장 유형이 확정되지 않았으므로 한 번의 수치만으로 정상 판단하지 마십시오.",
    "현장 소음, 진동, 온도 상승이 함께 보이면 무리하게 계속 운전하지 말고 즉시 보고하십시오."
  ],
  "evidence": {
    "priority_score": 82.4791178416,
    "current_best": "urgent",
    "m1_specialist": "unknown_review",
    "main_signals": [
      "검토 사유: 이상 기준에 근접한 신호",
      "위험도: 중간",
      "의심 유형: 고장 유형 미확정",
      "판단 근거: 위험도는 높지만 의심 유형 근거는 약해 추가 확인 필요"
    ],
    "used_tools": [
      "get_ops_evidence",
      "get_external_context"
    ]
  }
}
