{
  "decision": {
    "priority": "urgent",
    "operator_review": "Required",
    "data_quality": "Medium"
  },
  "summary": "가재마을4단지세종센트레빌아파트 25번 열수급 지점은 위험도가 높아 즉시 확인이 필요한 상태입니다. 난방과 급탕이 함께 연결된 구간에서 이상 의심 신호가 함께 나타나고, 판단 근거가 일관되어 현장 재점검이 필요합니다. 세종 지역의 기온이 다소 낮아 운영 부하가 약간 올라갈 수는 있으나, 이번 이상을 단독으로 설명할 정도의 수준은 아닙니다.",
  "action_plan": [
    "기계실에서 열교환기 전후 온도와 압력, 유량이 평소와 다른지 먼저 확인하십시오.",
    "순환 상태가 불안정한지 보고, 펌프 운전음·진동·전류값 이상 유무를 즉시 점검하십시오.",
    "압력 조절 계통과 관련 밸브의 개도 상태, 응답 지연, 걸림 여부를 확인하십시오.",
    "스트레이너와 필터 막힘, 배관 연결부 누수, 밸브 주변 결로 흔적을 순서대로 확인하십시오.",
    "가재마을4단지세종센트레빌아파트 기계실에서 해당 열수급 지점의 운전값과 주요 센서 계통을 우선 대조합니다."
  ],
  "caution": [
    "안전장비를 갖추고 2인 이상 협업으로 점검하십시오. 고온 배관과 급격한 압력 변동에 주의가 필요합니다.",
    "현재는 이상이 확정된 상태가 아니므로, 한 가지 징후만으로 원인을 단정하지 마십시오.",
    "운전 중 차단이나 조작이 필요한 경우에는 영향 범위를 먼저 확인하고 단계적으로 진행하십시오.",
    "추가 점검 항목은 원인 확정이 아니라 확인 범위를 좁히기 위한 보조 기준입니다."
  ],
  "evidence": {
    "priority_score": 95.0149541155,
    "current_best": "urgent",
    "m1_specialist": "unknown_review",
    "main_signals": [
      "대상 단지: 가재마을4단지세종센트레빌아파트 (25번 열수급 지점)",
      "기상 요인: 난방도시 기준 난방 부하 증가 가능",
      "위험도: 긴급",
      "의심 유형: 고장 유형 미확정",
      "판단 근거: 위험도와 의심 유형이 함께 높게 나타남"
    ],
    "used_tools": [
      "get_ops_evidence",
      "get_external_context",
      "get_site_context",
      "get_weather_context",
      "rag_http_server"
    ]
  }
}
