{
  "decision": {
    "priority": "high",
    "operator_review": "Required",
    "data_quality": "Medium"
  },
  "summary": "가재마을3단지중흥S클래스에듀타운아파트 24번 열수급 지점에서 위험도가 높게 나타났고, 밸브 구동부 이상 의심이 우세합니다. 위험도와 의심 유형이 함께 높게 나오므로, 현장 확인 없이 운전 상태를 그대로 두기보다 즉시 점검이 필요합니다. 조회 구간의 기상은 운영 부하 참고 수준이며, 이번 판단의 직접 원인으로 보기는 어렵습니다.",
  "action_plan": [
    "밸브 구동부의 실제 동작 여부를 먼저 확인하고, 수동 조작 시 열림·닫힘 응답이 정상인지 점검하세요.",
    "제어 신호가 들어갈 때 밸브가 끝까지 움직이는지, 중간 걸림이나 지연이 있는지 현장에서 확인하세요.",
    "밸브 주변 배관과 연결부에 누수, 외부 손상, 이물 끼임, 체결 풀림이 있는지 육안 점검하세요.",
    "공급·환수 온도와 차압 변화를 확인해 밸브 이상으로 인한 유량 변동이 있는지 살펴보세요.",
    "가재마을3단지중흥S클래스에듀타운아파트 기계실에서 해당 열수급 지점의 운전값과 주요 센서 계통을 우선 대조합니다."
  ],
  "caution": [
    "현재는 이상이 확정된 상태가 아니므로, 무리한 조작이나 반복 개방·폐쇄 시험은 피하세요.",
    "고온 배관과 가동부 접촉 위험이 있으니 보호구를 착용하고 단독 작업은 가급적 피하세요.",
    "운전 유지가 필요한 경우에도 압력 급변과 온도 변동을 주의 깊게 감시하세요.",
    "추가 점검 항목은 원인 확정이 아니라 확인 범위를 좁히기 위한 보조 기준입니다."
  ],
  "evidence": {
    "priority_score": 94.7344222405,
    "current_best": "urgent",
    "m1_specialist": "valve_actuator",
    "main_signals": [
      "대상 단지: 가재마을3단지중흥S클래스에듀타운아파트 (24번 열수급 지점)",
      "기상 요인: 조회 구간에서 이상 신호 해석을 보완할 만한 뚜렷한 기상 요인은 확인되지 않았습니다.",
      "위험도: 높음",
      "의심 유형: 밸브 구동부 이상 의심",
      "판단 근거: 위험도와 의심 유형이 함께 높게 나타남"
    ],
    "used_tools": [
      "get_ops_evidence",
      "get_external_context",
      "get_site_context",
      "get_weather_context",
      "rag_http_server"
    ]
  }
}
